{"schema_version":1,"scanner_version":"0.0.0-golden","module":"headers","target":"https://example.com/","rule_packs":[{"id":"opencomply-headers","version":"1.2.0","sha256":"b709d5939032dc8c84c46e454959a1b35bc25d89638f4e0ef28aea0813c090bc","signed_by":"opencomply-2026"}],"platforms":[{"id":"cloudflare","name":"Cloudflare","layer":"cdn","evidence":{"class":"inferred","source":"GET https://example.com/","detail":"CF-Ray: 0123456789abcdef-BKK"}},{"id":"nginx","name":"nginx","layer":"server","evidence":{"class":"inferred","source":"GET https://example.com/","detail":"Server: nginx/1.24.0"}},{"id":"php","name":"PHP","layer":"framework","evidence":{"class":"inferred","source":"GET https://example.com/","detail":"X-Powered-By: PHP/8.2.1"}},{"id":"wordpress","name":"WordPress","layer":"framework","evidence":{"class":"inferred","source":"GET https://example.com/","detail":"HTML contains \"/wp-content/\""}}],"verdict":"fail","grade":{"grade":"D","score":58,"upgrades":[{"to":"C","steps":[{"rule_id":"HDR-002","points":25,"required":true,"impact":"Nonces need each response rendered per request (server or edge); fully static pages must use hashes, and inline or third-party scripts may need changes"}],"result":"B","result_score":83},{"to":"A+","steps":[{"rule_id":"HDR-002","points":25,"required":true,"impact":"Nonces need each response rendered per request (server or edge); fully static pages must use hashes, and inline or third-party scripts may need changes"},{"rule_id":"HDR-007","points":7,"required":true,"impact":"All http:// links and bookmarks are moved to https://; mixed http:// resources on the pages must be fixed"},{"rule_id":"HDR-010","points":5,"required":true,"impact":"None for users; only hides version details"}],"result":"A+","result_score":95}]},"summary":{"pass":5,"fail":2,"unknown":0,"not_applicable":0,"needs_review":3,"insufficient_evidence":0,"advice":1},"findings":[{"rule_id":"HDR-002","rule_version":"1.1.0","title":"Content-Security-Policy","status":"fail","severity":"high","evidence":[{"class":"verified","source":"GET https://example.com/","detail":"content-security-policy: default-src 'self'; script-src 'self' 'unsafe-inline' https://cdn.example.com"}],"reason":"script-src allows 'unsafe-inline' without a nonce or hash, so injected inline scripts can run","fix_hint":"enforce a CSP whose script-src allows no inline or wildcard scripts","example_fix":"change only script-src: script-src 'self' 'nonce-<random-per-request>' https://cdn.example.com","platform_fixes":[{"platform":"cloudflare","how":"Rules > Transform Rules > Modify Response Header > Set static: Content-Security-Policy","note":"A static Transform Rule cannot add a per-request nonce; set the CSP in the app, use hashes, or a Worker"},{"platform":"nginx","how":"add_header Content-Security-Policy \"...\" always; nonces: set them in the app, or sub_filter with $request_id"}],"remediation":"CSP limits which scripts can run, which reduces what injected code (XSS) can do. Generate a new random nonce per response and put it on every <script>, or use hashes for fixed inline scripts. With nonces, also set base-uri 'self' so an injected <base> tag cannot send the page's own scripts to another site. The example is a starting point, not a drop-in policy: review the whole existing CSP, check third-party scripts and framework hydration, roll out with Content-Security-Policy-Report-Only, fix what it reports, then enforce.","effort":"involved"},{"rule_id":"HDR-010","rule_version":"1.1.0","title":"Technology disclosure","status":"fail","severity":"low","evidence":[{"class":"verified","source":"GET https://example.com/","detail":"server: nginx/1.24.0; x-powered-by: PHP/8.2.1; meta generator: WordPress 6.5.2"}],"reason":"server, x-powered-by +1 tell attackers which software and version runs here","fix_hint":"remove X-Powered-By, version numbers and internal host names from headers and meta generator","platform_fixes":[{"platform":"nginx","how":"server_tokens off; PHP: fastcgi_hide_header X-Powered-By; proxy: proxy_hide_header X-Powered-By;","preferred":true},{"platform":"php","how":"php.ini: expose_php = Off","preferred":true},{"platform":"wordpress","how":"php.ini expose_php = Off, and hide the server version on the web server","note":"meta generator: remove_action('wp_head', 'wp_generator') in the theme's functions.php","preferred":true}],"remediation":"Version headers let attackers look up known vulnerabilities for your exact software without probing. Removing them is not a fix for outdated software, but it stops free reconnaissance. Keep the software updated as well. The same applies to a <meta name=\"generator\"> tag with a version, and to internal server names in X-Backend-Server or Server-Timing.","effort":"quick"},{"rule_id":"HDR-007","rule_version":"1.1.0","title":"HTTPS enforcement","status":"needs_review","severity":"high","evidence":[{"class":"verified","source":"GET https://example.com/","detail":"GET http://example.com/ → 302 → https://example.com/ 200"}],"reason":"http:// moves to https:// with a temporary redirect (302), which browsers do not remember","fix_hint":"redirect every http:// request to https:// with 301 or 308","example_fix":"http://example.com/ → 301 → https://example.com/","platform_fixes":[{"platform":"cloudflare","how":"SSL/TLS > Edge Certificates > Always Use HTTPS: On"},{"platform":"nginx","how":"server { listen 80; server_name example.com; return 301 https://$host$request_uri; }"}],"review_question":"Is the temporary redirect intentional? If not, make it 301 or 308.","remediation":"If http:// still serves the page, anyone on the network (public Wi-Fi, ISP) can read or change it. Redirect all http:// requests to the same path on https:// with a permanent redirect (301 or 308), then add HSTS (HDR-001).","effort":"moderate"},{"rule_id":"HDR-009","rule_version":"1.1.0","title":"Cookie security","status":"needs_review","severity":"medium","evidence":[{"class":"verified","source":"GET https://example.com/","detail":"sid (Secure, HttpOnly); theme (Secure, SameSite=lax)"}],"reason":"HttpOnly missing on theme, so page scripts can read it","fix_hint":"mark cookies Secure, HttpOnly (unless scripts need them) and SameSite=Lax","example_fix":"Set-Cookie: session=<value>; Path=/; Secure; HttpOnly; SameSite=Lax","platform_fixes":[{"platform":"php","how":"php.ini: session.cookie_secure=1, session.cookie_httponly=1, session.cookie_samesite=Lax","preferred":true},{"platform":"wordpress","how":"Core login cookies are HttpOnly; set FORCE_SSL_ADMIN true in wp-config.php and check plugin cookies","preferred":true}],"review_question":"Does page JavaScript need to read these cookies? If not, add HttpOnly.","remediation":"Secure keeps cookies off http://, HttpOnly hides them from scripts (so injected scripts cannot read them), SameSite=Lax limits cross-site requests (CSRF). Set them where the cookie is created: framework session settings or app code. A response that sets a session cookie should send Cache-Control: private (or no-store), so a shared cache never stores it and hands it to other visitors.","effort":"moderate"},{"rule_id":"HDR-005","rule_version":"1.2.0","title":"Permissions-Policy","status":"needs_review","severity":"low","evidence":[{"class":"verified","source":"GET https://example.com/","detail":"permissions-policy: camera=*, geolocation=()"}],"reason":"camera=* lets every embedded site use it","fix_hint":"send a valid Permissions-Policy that turns off features the site does not use","example_fix":"Permissions-Policy: camera=(), microphone=(), geolocation=(), payment=()","platform_fixes":[{"platform":"cloudflare","how":"Rules > Transform Rules > Modify Response Header > Set static: Permissions-Policy"},{"platform":"nginx","how":"add_header Permissions-Policy \"camera=(), microphone=(), geolocation=()\" always;"}],"review_question":"Do embedded sites need these features? If not, use =() or =(self).","remediation":"Permissions-Policy turns off browser features (camera, microphone, location, payment) the site does not use, so injected or embedded code cannot use them. List only features the site needs with (self).","effort":"quick","group":"response-headers"},{"rule_id":"HDR-001","rule_version":"1.1.0","title":"Strict-Transport-Security","status":"pass","severity":"high","evidence":[{"class":"verified","source":"GET https://example.com/","detail":"strict-transport-security: max-age=31536000"}],"example_fix":"Strict-Transport-Security: max-age=31536000; includeSubDomains","advice":"add includeSubDomains once every subdomain serves HTTPS, so subdomains are protected too"}]}