
{"schema_version":1,"scanner_version":"0.3.5","module":"headers","target":"https://example.com/","rule_packs":[{"id":"opencomply-headers","version":"1.1.0","sha256":"321106287793747f7f1909f0fb58a8f536d0796a7d455e75cb008fcd8f17107c","signed_by":"opencomply-2026"}],"platforms":[{"id":"cloudflare","name":"Cloudflare","layer":"cdn","evidence":{"class":"inferred","source":"GET https://example.com/","detail":"cf-ray: 8f1c2a3b4d5e6f70-BKK"}},{"id":"nextjs","name":"Next.js","layer":"framework","evidence":{"class":"inferred","source":"GET https://example.com/","detail":"x-powered-by: Next.js"}}],"verdict":"fail","grade":{"grade":"D","score":63,"upgrades":[{"to":"C","steps":[{"rule_id":"HDR-002","points":26,"required":true,"impact":"Nonces need each response rendered per request (server or edge); fully static pages must use hashes, and inline or third-party scripts may need changes"}],"result":"B","result_score":89},{"to":"A+","steps":[{"rule_id":"HDR-002","points":26,"required":true,"impact":"Nonces need each response rendered per request (server or edge); fully static pages must use hashes, and inline or third-party scripts may need changes"},{"rule_id":"HDR-005","points":6,"required":true,"impact":"Features not listed (camera, location, payment) stop working, including in embedded frames"}],"result":"A+","result_score":95}]},"summary":{"pass":6,"fail":3,"unknown":0,"not_applicable":1,"needs_review":0,"insufficient_evidence":0,"advice":1},"findings":[{"rule_id":"HDR-002","rule_version":"1.1.0","title":"Content-Security-Policy","status":"fail","severity":"high","evidence":[{"class":"verified","source":"GET https://example.com/","detail":"content-security-policy: default-src 'self'; script-src 'self' 'unsafe-inline' https://www.googletagmanager.com; frame-ancestors 'self'"}],"reason":"script-src allows 'unsafe-inline' without a nonce or hash, so injected inline scripts can run","fix_hint":"enforce a CSP whose script-src allows no inline or wildcard scripts","example_fix":"change only script-src: script-src 'self' 'nonce-<random-per-request>' https://www.googletagmanager.com","platform_fixes":[{"platform":"nextjs","how":"middleware (proxy): create a nonce per request, set the CSP header and read it with headers() in the layout","preferred":true},{"platform":"cloudflare","how":"Rules > Transform Rules > Modify Response Header > Set static: Content-Security-Policy","note":"A static Transform Rule cannot add a per-request nonce; set the CSP in the app, use hashes, or a Worker"}],"remediation":"CSP limits which scripts can run, which reduces what injected code (XSS) can do. Generate a new random nonce per response and put it on every <script>, or use hashes for fixed inline scripts. With nonces, also set base-uri 'self' so an injected <base> tag cannot send the page's own scripts to another site. The example is a starting point, not a drop-in policy: review the whole existing CSP, check third-party scripts and framework hydration, roll out with Content-Security-Policy-Report-Only, fix what it reports, then enforce.","effort":"involved"},{"rule_id":"HDR-005","rule_version":"1.1.0","title":"Permissions-Policy missing","status":"fail","severity":"low","evidence":[{"class":"verified","source":"GET https://example.com/","detail":"(header not present)"}],"reason":"response has no permissions-policy header","fix_hint":"send a Permissions-Policy that turns off features the site does not use","example_fix":"Permissions-Policy: camera=(), microphone=(), geolocation=(), payment=()","platform_fixes":[{"platform":"cloudflare","how":"Rules > Transform Rules > Modify Response Header > Set static: Permissions-Policy"},{"platform":"nextjs","how":"next.config.js headers(): { key: \"Permissions-Policy\", value: \"camera=(), microphone=(), geolocation=()\" }"}],"remediation":"Permissions-Policy turns off browser features (camera, microphone, location, payment) the site does not use, so injected or embedded code cannot use them. List only features the site needs with (self).","effort":"quick","group":"response-headers"},{"rule_id":"HDR-010","rule_version":"1.1.0","title":"Technology disclosure","status":"fail","severity":"low","evidence":[{"class":"verified","source":"GET https://example.com/","detail":"x-powered-by: Next.js"}],"reason":"x-powered-by tells attackers which software runs here","fix_hint":"remove X-Powered-By, version numbers and internal host names from headers and meta generator","platform_fixes":[{"platform":"nextjs","how":"next.config.js: poweredByHeader: false","preferred":true},{"platform":"cloudflare","how":"Rules > Transform Rules > Modify Response Header > Remove: X-Powered-By"}],"remediation":"Version headers let attackers look up known vulnerabilities for your exact software without probing. Removing them is not a fix for outdated software, but it stops free reconnaissance. Keep the software updated as well. The same applies to a <meta name=\"generator\"> tag with a version, and to internal server names in X-Backend-Server or Server-Timing.","effort":"quick"},{"rule_id":"HDR-001","rule_version":"1.1.0","title":"Strict-Transport-Security","status":"pass","severity":"high","evidence":[{"class":"verified","source":"GET https://example.com/","detail":"strict-transport-security: max-age=31536000"}],"example_fix":"Strict-Transport-Security: max-age=31536000; includeSubDomains","advice":"add includeSubDomains once every subdomain serves HTTPS, so subdomains are protected too"}]}
